feedId,descr,trim_audio
37,Four Corners Area Fire and EMS,False
60,"Colorado State Patrol - El Paso, Teller, and Pueblo Counties",False
61,Weld County Sheriff,False
119,"Bureau County Sheriff, Fire and EMS",False
121,"Illinois State Police, IDOT, EMA and LaSalle County Sheriff",False
123,Sangamon County Public Safety,False
139,Twin State Fire Mutual Aid,False
141,Coos and Grafton Counties Police and Fire,True
149,Yadkin County Fire and EMS,False
171,"Findlay Fire, Hancock County Sheriff, Fire and EMS, Ohio State Highway Patrol
",False
188,Allen County Public Safety,False
215,Memphis Police and Shelby County Sheriff,False
217,Germantown Police and Fire,True
222,West Metro Fire Rescue,False
236,Beaver County Fire and EMS,True
290,Mobile County/City and Area Fire,False
318,Oklahoma City Area Police and Fire,False
329,Boone County Fire and EMS,False
384,Whitley County Fire Dispatch,False
463,Allegheny County Fire - North,False
500,Baker County Sheriff and Fire,False
511,"Chicago Suburban Fire Departments, MABAS and IFERN",False
519,Essex and Southern Rockingham Counties Fire / EMS,False
527,Fredericksburg City and Spotsylvania County Fire and EMS,False
549,New Orleans Fire,False
590,"Susquehanna, Wayne, Lackawanna, and Wyoming Counties Fire / EMS",False
592,Spotsylvania County Fire and Rescue,True
648,Brazos County Area Fire and EMS,False
650,"Calhoun County Sheriff, Fire, and EMS",True
665,"Spencer County Sheriff, Fire, and EMS",False
683,"Kalamazoo City, Township and County Fire Dispatch",False
690,Erie County Fire and EMS,False
747,"Santa Barbara County Sheriff, Fire, Aircraft and Marine, Lompoc Police / Fire",False
802,Jersey City Fire,False
807,Crawford County Sheriff and Fire,False
829,"Los Angeles County Sheriff, Fire and Aircraft - Santa Clarita Valley",False
856,Fall River Police and Fire,True
865,Napa County Fire and CAL FIRE LNU East,True
909,Chicago Fire - Digital,False
938,"Carroll, Chariton, Linn, Livingston Counties Public Safety ",False
946,Mulvane Fire and EMS,True
1102,Washington County Fire and EMS,False
1113,Blount County Public Safety,True
1137,Grundy County Consolidated Dispatch Center,False
1162,Huntington City and County Police and Fire,False
1176,"Southern Tablelands RFS, PMR, GRN, and FRNSW South/West Dispatch",True
1189,NYPD Bronx/Manhattan Transit,False
1205,Wichita Falls Area Law Enforcement ,False
1331,"Elk County Police, Fire and EMS",False
1364,Harris County Law Enforcement - North,False
1432,Perth Fire and Rescue Service - Command,False
1433,West Mahoning County Fire Departments,False
1440,Albany City Fire,False
1444,Suffolk County Police Departments,False
1452,"Lebanon County EMS, Fire Police and Hazmat",False
1456,Lebanon County Fire ,False
1461,"Grundy and Livingston Counties Law, Fire and EMS Dispatch",False
1467,Harrison County Fire and EMS,False
1524,"Meeker County Sheriff, Police, Fire, and EMS",True
1532,"Wellesley Police and Fire, AreaWide3, Metro Fire",False
1541,Loudoun County Combined Fire Rescue,False
1549,Boylston Area Police and Fire,False
1554,Portage County Law and Fire,False
1558,Livingston Fire and EMS,False
1594,Des Moines Fire/EMS,False
1605,Metropolitan Washington Airports Authority (MWAA) Public Safety,False
1620,Fairfax County Fire and Rescue,False
1633,Nassau County Police,False
1634,Suffolk County Fire - West,False
1635,Nassau County Fire - East,False
1651,"Washington County, Maplewood and North Saint Paul Public Safety",False
1654,Kent County Fire Dispatch,False
1661,LaCrosse County Fire and EMS,False
1692,Ross County Public Safety,False
1709,Volusia County Fire and EMS,False
1719,"Grenada Police, Fire, EMS and Weather Alerts",False
1775,Amherst Fire Control,False
1790,"Ritchie and Doddridge Counties Police, Fire, and EMS",False
1813,"Newington Police, Fire and EMS",False
1836,"Totowa Police, Fire and EMS",False
1858,"Cameron County Police, Fire and EMS",False
1883,Solano County Fire 1,False
1897,Orange and San Diego Counties Working Incident 1,False
1929,"Butte County Fire / CalFire, Chico Fire",False
1932,"South Bay Fire: Culver City, El Segundo, Manhattan Beach, Redondo Beach, Torrance",False
1996,Cache County Public Safety,True
2022,Rockland Fire,False
2052,Monroe Township Fire Operations,False
2068,Allegany County Fire,False
2120,Eastern Missouri Public Safety,False
2142,Westport Fire,False
2202,BEU CAL FIRE and San Benito County Public Safety,False
2206,Liberty and Calhoun Counties Fire and EMS,False
2221,"Dover, Medfield and Millis Fire",False
2236,Clark County Public Safety - CRESA Digital,False
2317,Kittitas County Public Safety,False
2341,Concord Fire Alarm - Capital Area,False
2364,"Spencer Area Police, Fire and EMS",False
2411,Weakley County Public Safety,False
2421,East Hartford Police,True
2504,"Blair County EMS, Fire, Police, Hazmat and Helos",False
2506,Lorain County Public Safety - North,False
2530,Sherbrooke Fire,False
2546,"Laurel County and City Fire, Rescue, Police, and EMS Dispatch ",False
2588,Louisa County Fire and EMS,False
2653,South Australian Emergency Services ,True
2681,Dallas City Fire and Rescue Dispatch,False
2718,"UCM Police, Warrensburg Fire, and EMS",False
2757,West Central IL and North East Mo Counties Public Safety,True
2762,"Knox County Police, Fire and EMS",False
2771,Saraland Fire and Rescue Dispatch,False
2823,Rockland County Fire Dispatch - 44-Control,True
2825,Lee County Fire and EMS,False
2846,Los Angeles City Fire,False
2859,Concord Fire,False
2897,"Powell Police, Fire and EMS",False
2915,South Windsor Fire and EMS,False
2932,"Lorain County Police, Fire and EMS",False
2945,"Medina County Sheriff and Fire, Medina / Montville Township Police, Life Support Team (EMS)",False
2978,Woodbury Fire Dispatch,False
2982,"Linn County Police, Fire, and EMS",False
2994,Decatur and Morgan County Public Safety,False
2996,Jefferson County Police Dispatch,False
3050,"Darlington County Fire, EMS, and State Forestry",False
3053,McLeod County Public Safety,False
3063,Township Of Moon Police,False
3140,Toronto Fire Services Automated Dispatch - South Zone,False
3157,"Mason County Fire, Sheriff, and EMS, Ludington Fire, Police, and EMS",False
3285,Hardin County Fire and EMS,False
3289,"Walworth County Sheriff and EMS, Racine County Fire / EMS - West of I-94",True
3292,McKinney Fire and EMS,False
3316,"Washington, Saratoga and Warren Counties Sheriff",False
3331,"Jackson, Mason, and Meigs Counties Fire and EMS",False
3415,Powhatan County Fire & Rescue,True
3437,Woodbine and Dennis Township Fire and Rescue,False
3503,"Allegan County Police, Fire and EMS - Conventional / Digital",False
3554,Lake County Quad 1 Fire Departments,False
3569,"LaSalle, Marshall, Bureau and Putnam Counties Fire and EMS Departments",False
3609,"Ennis Police and Fire, Ellis County Sheriff",False
3619,"Wadsworth Police, Fire and EMS",False
3626,"Albany City and Colonie, Police, Fire and EMS",False
3671,"St. Joseph County Sheriff, Police, Fire and EMS",False
3683,"Wayne County Sheriff and Fire, Wooster, Rittman, Doylestown Police, Rittamn EMS",False
3691,Evansville Police and Fire Dispatch,False
3751,Schoharie County Public Safety,False
3790,Lycoming County Public Safety,True
3818,Buffalo Fire,False
3831,"Coles County Fire, EMS and EMA",True
3969,Eastern Massachusetts State Police,False
3973,Parsippany Fire and Operations - Digital,False
4041,Rankin County Police and Fire,False
4043,"Livingston County Sheriff, Police, Fire and EMS",False
4067,St. Charles County EMS and Fire Scene Radio Traffic,False
4092,"Tri-County Public Safety

",False
4130,"Oneida, Herkimer, and Madison Counties Public Safety",False
4136,Berks County Fire and EMS - Digital,False
4142,"Springfield Police and Fire, Greene County Sheriff and Fire",True
4157,Jackson Police and Fire,False
4180,Auburn and Lewiston Fire and EMS,False
4213,Rocky Mountain Rescue Group,False
4233,Tulare County Sheriff 1,True
4241,Clatsop County Public Safety,False
4352,Lenoir County and Kinston Fire Dispatch,False
4563,"Raleigh County Police, Bradley Fire and WV State Police",False
4575,Branford Fire,False
4603,Philadelphia Police - Citywide,False
4654,"Deschutes, Crook, Jefferson counties Fire / EMS",False
4670,Floyd County Fire Dispatch,False
4822,Eau Claire County Law Enforcement,False
4881,"Fairfield, Vacaville, and Suisun Police, Fire and EMS",False
4884,Coshocton City and County Fire,False
4913,"Oneida, Vilas, Lincoln, and Langlade Counties Police, Fire and EMS / Forest EMS",False
5017,Franklin Police and Fire,False
5035,"Crawford County Sheriff, Police, Fire and EMS",False
5053,Connecticut State Police and Bristol Fire and EMS,False
5094,Gratiot County Police and Fire,False
5101,Henry County Public Safety,False
5104,Middletown and Monmouth County Bayshore Towns Fire / EMS,False
5138,Lakes Region Mutual Fire Aid Association,False
5161,Worcester City Fire and EMS,False
5163,Worcester City Police,False
5184,Cincinnati Fire,False
5225,South Worcester County Communications Center,False
5250,King George County Fire and EMS,False
5266,"Ionia County Sheriff, Fire and EMS",False
5318,Dallas City Police - 1 Central,False
5331,"Dearborn County Police, Fire and EMS",True
5342,"Natchitoches Parish, Sabine Parish, and Vernon Parish Public Safety",False
5358,Columbia and Montour County Fire and EMS Dispatch,False
5368,Saline County Law Enforcement and AWIN,True
5424,"Louisiana State Police - Troops B, C, L",True
5444,Mineral County Public Safety and Amateur Repeaters ,True
5447,Rockland County Fire 2 and 3 - 44-Control,True
5465,Marion County METCOM North-1 Fire,False
5578,"NSW Far South Coast Fire, Flood and Storm",False
5661,Hamden Fire,False
5675,"Darke, Mercer, Randolph, Shelby and Jay Counties Fire and EMS",False
5684,Lower Naugatuck Valley Fire and EMS,False
5688,Sacramento County Sheriff and City Police,False
5698,"Citrus Heights Police, Folsom Police, Elk Grove Police and Galt Police",False
5712,Stratford Fire and EMS - Analog,False
5725,Des Moines Police Dispatch 1,False
5728,Wythe County and Town of Wytheville Fire and EMS,False
5822,Indiana County Fire Dispatch and Fireground Operations,False
5849,"Barry County Sheriff, Fire, and EMS",False
5909,Lumpkin County Fire Dispatch,False
5915,"Kenosha County Sheriff, Silver and Twin Lakes Police",True
5930, Douglas County Fire Department 800Mhz,False
6007,"Jefferson County Police, Fire and EMS",False
6053,Anderson County Law Enforcement,False
6074,Washington County Sheriff Dispatch,False
6089,Waltham Fire,False
6149,"Barton County Sheriff, Police, Fire and EMS",False
6156,California Police and Moniteau County Sheriff,False
6168,Putnam County NY FIRE & EMS-Response Div 4,False
6248,"Mendocino County Sheriff, Fire, EMS, Cal Fire and CHP",False
6250,Warren County and McMinnville Public Safety,False
6300,Ipswich Fire Dispatch,False
6302,Muhlenberg County Fire,False
6316,Tulare County Sheriff 2,True
6336,San Francisco City Fire and EMS,False
6369,Tulare City Police and Fire Dispatch,True
6377,Tacoma Fire,False
6413,Douglas County Sheriff and Fire,False
6436,"Jefferson County Sheriff, Fire and EMS",False
6502,"Southern Rhode Island, Southeastern Massachusetts, and Eastern Connecticut Public Safety",False
6561,"Flathead County Law, Fire and EMS",False
6773,Pictou County Fire VHF Paging & Ops,True
6779,Windsor County Fire - South,False
6787,Claremont Police and Fire,False
6850,Rochester Police,False
6855,Litchfield County Fire and EMS Departments - Southern,False
6882,"Delta County Law, Fire and EMS",True
6901,"Washington County Police, Fire and EMS",False
6903,"Butler County Area Sheriff, Police, EMS and EMA",False
6956,Westfield Fire and Union County Fire Mutual Aid,False
7004,Ocean County Fire and EMS - Northern,False
7006,Agawam Fire and EMS,False
7010,San Bernardino County Fire - High Desert,True
7047,"Humboldt County Law, Fire and EMS - Eureka and South",False
7160,Ingham Out-County Fire and EMS,True
7191,"Fayetteville Police, Fire, and EMS",False
7192,Duncan Police and Stephens County Sheriff,False
7287, Norfolk City Police Dispatch - 2nd Precinct,False
7296,Clifton Fire and EMS,False
7324,Rochelle Park and Maywood Fire,False
7364,Reno and Sparks Police and Fire,False
7372,Tulare County Fire and CHP Pink,True
7392,Hatzolah EMS Dispatch,False
7543,Hampden County Fire Departments,False
7576,Southern Rhode Island and Southeastern Connecticut Fire and EMS,False
7605,"Logan County Sheriff, Fire and EMS, Atlanta Fire",False
7647,"Cass County Sheriff, Police, Fire, and Skywarn",False
7671,Stafford County and Fredericksburg Fire and EMS ,False
7700,Allegheny County Fire - East,False
7743,Mareeba Police,False
7747,Gurnee and Newport Township Fire Departments,False
7790,Genesee County Common and Mutual Aid,False
7791,Genesee County EMS,False
7792,Genesee County Fire,False
7800,Fenton City Police and Fire,False
7815,Flint City Fire,False
7860,Siskiyou and Northern Shasta Counties Fire ,True
7959,Frederick County Fire and Rescue Dispatch,False
7971,"Allegheny County Police, Fire and EMS - Southern Areas",True
8051,Fort Payne Police,False
8117,Howard County Fire Dispatch,False
8182,Livingston County Fire and EMER ,False
8192,Sayville Fire Dispatch,False
8229,"North Manchester Police, Fire, and EMS",False
8277,Sweet Grass County Public Safety,False
8294,"Yuba County Sheriff, Wheatland and Marysville Public Safety",False
8317,Westcom Police Dispatch,False
8394,"Jackson County Police, Fire, and EMS",False
8401,"Morgan County Sheriff, Police, Fire and EMS",False
8543,Elko City and County Public Safety,True
8609,Jefferson County Police and Fire,False
8621,Blount County Fire & EMS Dispatch,True
8637,"Louisville MetroSafe Suburban Fire 5 - 8, Okolona Tac 80",False
8666,Middleton Police,False
8684,LA County Fire: D-3 TRO & Command C30-C33,False
8690,East Windsor Fire and EMS,False
8705,Greater New Haven Police,False
8755,"DeWitt County Sheriff and Fire, Cuero Police and EMS",True
8787,SIM Montreal Fire Dispatch,False
8811,Stoughton Area Fire Agencies,False
8846,"West Allis Police, Fire, EMS and DPW",False
8919,Chula Vista Police and Fire,False
8972,Roane County Fire and EMS,False
8978,Wyoming County Fire and EMS,False
9053,Plainville Fire,False
9079,Tolland County Fire Departments,False
9119,"Bradley County Sheriff, Cleveland Police, Fire Rescue and MAC",False
9121,"Miami County Police, Fire and EMS - Central",False
9125,New Bedford Fire,False
9186,Delaware County Fire - Ops 1,False
9189,Cortland County Public Safety,False
9247,Torrington Police and Fire,False
9276,Kings County Sheriff and Corcoran Police,False
9312,Flower Mound Fire Department Dispatch,False
9340,Stockton Police and Fire Dispatch,False
9366,Eastern Columbia and Western Luzerne Fire and EMS,False
9392,"Pulaski county Sheriff, Fire and EMS",False
9413,"Watauga County Fire, EMS and Rescue, Boone and Blowing Rock Fire",False
9474,"Springfield, Nixa, Ozark, Republic, Marshfield and Greene County Fire ",True
9518,"Randolph County Sheriff and EMS, Moberly Police / Fire",False
9574,"Brown County Sheriff, Aberdeen Fire/Rescue, State Highway Patrol

",True
9581,"Berkshire County Fire, Police and EMS - Central-Northern",False
9597,Dane County Fire,False
9689,Lake Oswego Fire,False
9721,Norfolk County Fire Control,False
9741,Tioga County Sheriff and Fire,False
9751,Rice County Fire and EMS,False
9766,Yamhill County Fire,True
9768,Jackson County Public Safety and MSWIN,False
9783,"Chesterfied County EMS, McBee Rescue, and Alligator Fire District",False
9797,Lincoln and Pike Counties Fire and EMS,False
9809,"Frederick County Sheriff, Fire and EMS, State Police",False
9821,Fulton County Public Safety,False
9840,Milwaukee County Law Enforcement,False
9841,Kalgoorlie Fire and Rail,False
9878,Hopkinton Fire,False
9974,Harrison Metro Area Fire & EMS,False
9993,Montgomery Borough area Fire and EMA,False
10114,"Olean Police and Fire, Cattaraugus County Sheriff / Fire, NYSP-TROOP-A",False
10120,Brunswick County Fire and Rescue,False
10141,"Barbour County Police, Fire and EMS",False
10142,Sullivan and Surrounding Area Public Safety,False
10171,"St. Lawrence County Police, Fire, and EMS",True
10207,Dartmouth Fire - District 1,False
10232,Maricopa County Sheriff - West ,False
10239,California Highway Patrol - Los Angeles and Orange County Centers,False
10257,Prosper Fire and EMS,False
10277,"Clinton County Fire, EMS and Highway DOT",False
10280,Adair County Fire,False
10294,San Diego City and Poway Fire,True
10298,Floyd County Fire (SAFE-T),False
10314,Adams County and Hastings Fire / EMS,False
10341,"Mat-Su Borough Police, Fire and EMS Dispatch ",False
10380,Grayson County Law Enforcement and EMS,False
10387,Lancaster Police and Fire,False
10449,"Willmar Police, Fire and EMS",False
10489,Montgomery County Fire and EMS - East,False
10591,"Aurora Police, Fire and EMS Dispatch",True
10597,Nocona Fire and Police Dispatch,False
10622,Kent County Fire and EMS,False
10637,"Nez Perce and Asotin Counties Sheriff, Fire and EMS",True
10662,St-Georges de Beauce Fire and EMS,False
10670,Orange County Fire and EMS,False
10676,Granby and Windsor Public Safety,False
10717,Westport Fire,False
10729,"North Harris, Montgomery, Waller and Walker Counties Fire and EMS",False
10852,Crystal Lake Fire Rescue,False
10870,Franklin County Fire and EMS Dispatch,False
10892,North Comm Dispatch and LE Interop,True
10911,Eastern Upper Peninsula Public Safety,False
10948,Fairmont Police and Fire and Marion County Sheriff and EMS,False
10953,"Richland County Police, Fire, and EMS, Wilkin County Sheriff",False
10989,"Dare County Fire, EMS and Ocean Rescue",False
11148,"Columbus Division of Fire, Franklin County Fire and EMS",False
11208,Columbus Police Dispatch - Citywide,False
11237,Cheektowaga Depew Lackawanna Fire,False
11245,Haverhill Fire,False
11319,Roselle Park Fire & UCMA,False
11324,"Logan County Sheriff, Fire, and EMS, Sheriff, Sterling Police, State Patrol",False
11446,Cleveland Police and Metro Housing Authority,True
11466,Peoria County Fire - Digital,False
11549,"Shelter Island and Southold Police, Fire, EMS and Highway",False
11563,Point Pleasant Borough Fire 1 & Fire 3,True
11573,"Southern Berkshire County Police, Fire and EMS",False
11618,Tennessee Highway Patrol District 8,False
11697,Gippsland CFA / FRV / FFMV,False
11789,East Islip Fire,False
11797,"Farmington Police, Fire and EMS",False
11832,"Mingo and Pike Counties Sheriff, Fire, and EMS, Williamson Police and Fire",False
11880,"NSW Fire and Rescue - Albury, Wagga Wagga",False
11912,"Carver Fire, Police, and EMS, Plymouth Fire/EMS, Wareham and Plympton Fire",False
11923,Livingston County Fire and EMS Dispatch,False
11954,Oldham County Fire and EMS Dispatch,True
11979,Berlin Fire Dispatch,False
11995,San Diego CHP Orange/Blue and the RCS Law Mutual Aid,False
12004,El Paso County Fire and EMS,False
12032,Bowling Green Fire and Bowling Green State University Police,False
12137,"Summit County Sheriff, EMS and Park City Police",True
12145,Phoenix Police,False
12151,Osage County Fire and EMS,False
12156,Buncombe County Fire,False
12174,Monroe and Ontario Counties Fire - Digital,False
12199,Del Rio (TX) DPS,False
12208,Streator Fire,False
12261,Waukesha County Law Enforcement,True
12297,Tiverton Fire,False
12336,"Phillips County Law Enforcement, Fire, and EMS",False
12357,"Waterford Police, Fire, and EMS",False
12388,Pike County and Lackawaxen Fire and EMS,False
12411,"Saunders County Sheriff, Fire and EMS",False
12439,Benton County Sheriff and Camden Police,False
12466,Black Hawk County Fire and EMS,False
12477,Davidson County Fire,False
12495,"Logansport Police / Fire, Cass County Sheriff, Fire and EMS, Miami County Sheriff",False
12522,Adams County Fire and EMS - Digital,True
12623,Clinton County Public Safety,True
12637,Benton County Public Safety,False
12697,Trimble County Fire and EMS,False
12699,Vineland Fire,False
12765,Salem Police Dispatch,False
12829,Service d'incendie MRC Maskoutains,False
12830,"Hopkinton Police, Fire and DPW",False
12861, Mitchell County Fire ,False
12876,"North St. Louis County Sheriff, Fire and Roads",True
12911,Contra Costa County Fire Protection District,False
12947,Franklin County Fire Operations,False
12966,Groton Fire Dispatch,False
13008,Redwood County Public Safety,False
13058,Charlotte and Mecklenburg County Fire,False
13125,South Central Iowa Counties Public Safety,False
13160,Accomack County Public Safety,False
13177,Manteca Public Safety,False
13189,"Columbia County Sheriff and Fire, Hudson Police",False
13197,Robbinsville & Mercer County Fire and EMS,False
13203,Napa City and American Canyon Fire Dispatch,False
13209,"Cocke County Sheriff, Fire, and EMS, Newport Police and Fire",True
13241,"Cass County Public Safety, Iowa State Patrol",False
13249,Sunnyvale Fire,False
13254,"Edgefield County Sheriff, Fire and EMS",False
13323,Audrain County Missouri Public Safety,True
13353,"Tri-Boro, Park Ridge, Woodcliff Lake and Montvale Police Dispatch",False
13375,"Palmer Fire, Police and EMS",False
13376,Willimantic and Area Fire/Police,False
13383,Niagara County Fire Dispatch - Analog,False
13408,New Jersey Statewide Medevac,False
13416,Troy Fire Department,True
13434,Hamilton Township Fire,False
13449,"Caroline, Queen Anne's, and Talbot Counties Fire",False
13451,Morrow County Fire and EMS,False
13481,New Jersey State Police Troop C,True
13537,Mifflin County Law Enforcement,False
13549,"Fresno City Police, Fire and EMS",False
13550,Brimfield Fire Dispatch,False
13553,"Morgan County Fire, EMS and Mutual Aid",False
13618,Seneca County Fire and EMS,False
13632,Atlantic and Cape May Counties Fire and EMS - Southern,False
13671,Detroit Police Dispatch,False
13681,Guernsey County Sheriff and Ohio State Patrol Post 30,False
13705,Southwest Summit County Public Safety,True
13736,"Blue Earth and Faribault Counties Sheriff, Police and EMS",False
13743,Brown County Public Safety,False
13764,Dane County Fire and EMS,False
13776,Perry County Fire and EMS,False
13799,"Macedonia, Northfield Village and Sagamore Hills Police, Fire / EMS",False
13883,Madison County Fire and EMS,False
13891,"Green County Sheriff / Fire, Monroe and Brodhead Police",False
13928,Marion County Public Safety,False
13931,Hockley County Public Safety,False
13938,New Albany Police and Fire,False
13951,PA Turnpike Police Harrisburg - East,True
13984,"Napa County Primary - Napa City Police, and Napa County Sheriff ",False
14000,Arequipa Volunteer Fire 2,False
14003,Bristol Fire and EMS Dispatch,False
14027,Geauga County Public Safety,False
14029,"Bakersfield Police, Fire and EMS",False
14086,Delaware County Fire and EMS,False
14111,Amarillo Police and Fire,False
14123,Country Fire Authority Regional Dispatch,False
14176,"Kokomo Police and Fire, Howard County Sheriff / Fire Dispatch",False
14178,Central Alarmas Bomberos Temuco,False
14215,Salem County Fire / EMS Digital,False
14233,Southbridge and Area Fire Departments,False
14279,Sonoma County Fire and CAL FIRE Dispatch - North West,False
14324,Northampton Fire,False
14332,Cowley County Fire,False
14388,Lebanon Fire Dispatch ,True
14405,Greenfield Fire,True
14408,Warren Fire and EMS Dispatch,False
14412,Chandler Volunteer Fire,False
14433,Winsted Area Ambulance Association,False
14439,Travis County Law Enforcement,False
14441,"Bedford County Fire, EMS and Law",False
14442,Southeast Missouri Counties Public Safety,False
14497,North Adams Ambulance,False
14518,Morristown Fire,False
14527,"Hamilton County Police, Fire and EMS Dispatch",False
14541,Hamilton County Fire,False
14542,Hamilton County EMS,False
14584,Downers Grove and Westmont Police/Fire,False
14589,Algona Police and Fire,False
14639,Essex Fire and Rescue,False
14640,Libby Volunteer Fire ,False
14672,Hand County Public Safety,True
14692,Aberdeen Fire and EMS Dispatch,False
14693,Franklin County Fire and EMS,True
14719,Golden Valley Fire and EMS,False
14744,Virginia Beach EMS,False
14783,First Medic Ambulance,False
14826,East Placer and Nevada Counties CAL FIRE NEU - Kings Beach Area,False
14843,Broadwater Volunteer Fire,False
14850,Racine and Kenosha Counties Fire Working Incidents,False
14852,Sheboygan County Fire and EMS,False
14863,Alpena Fire ,False
14874,Orange County Public Safety,True
14875,"Chandler Police and Fire, Phoenix Fire",False
14891,LaSalle County Fire and EMS,False
14893,Brookline Police / Fire,False
14920,La Salle County Sheriff and Fire Departments ,False
14940,Centerville Fire,False
14944,Killdeer Area Ambulance,False
14952,Orleans Fire,False
14993,Lawrence Fire,False
14994,Glover Ambulance,False
15048,Franklin-Bingham Fire Dispatch,False
15095,Kinney County Fire Rescue,False
15102,Philadelphia Police Dispatch - South,False
15129,Frederick County Fire - Digital,False
15192,Mandan Rural Fire,False
15195,Philadelphia Police Dispatch - Southwest,False
15208,"Mammoth Lakes Police / Fire, Mono County Sheriff, Fire and EMS Dispatch",False
15215,Williams Fire Protection Authority,False
15230,Scott County Emergency Services,False
15234,WestCom Fire and West Suburbs Police - Digital MARCS,False
15244,Plattsmouth Volunteer Fire,False
15256,Spurger Volunteer Fire,False
15277,Le Mars Fire and Rescue,False
15279,Hayti Fire,False
15294,Mercer County Fire,False
15309,Grosse Pointes and Harper Woods Police and Fire ,False
15325,Crookston Fire,False
15327,Rapides Parish Fire District 6,False
15332,Paterson Fire - West,False
15353,Monetta Fire Dispatch,False
15378,Ethan Fire,False
15386,Northern Illinois and Southern Wisconsin MABAS,False
